Book	#	Event Description	Verse Range
Ruth	20	Naomi identifies Boaz as one of their kinsman-redeemers.	Ruth 2:19–20
Ruth	21	Ruth continues gleaning in Boaz’s field until the end of the barley and wheat harvests.	Ruth 2:21–23
Ruth	22	Naomi instructs Ruth to wash, anoint herself, put on her cloak, and go to the threshing floor at night.	Ruth 3:1–5
Ruth	23	Ruth goes to the threshing floor, uncovers Boaz’s feet after he lies down, and lies at his feet.	Ruth 3:6–7
Ruth	24	At midnight Boaz awakens, discovers Ruth at his feet, and she asks him to spread his wing over her.	Ruth 3:8–9
Ruth	25	Boaz blesses Ruth for her kindness and promises to do the part of kinsman-redeemer if the nearer one will not.	Ruth 3:10–13
Ruth	26	Boaz gives Ruth six measures of barley so she will not return empty-handed to Naomi.	Ruth 3:14–15
Ruth	27	Ruth returns before dawn, tells Naomi everything, and Naomi says to wait and see what happens.	Ruth 3:16–18
Ruth	28	Boaz goes to the city gate and waits until the nearer kinsman-redeemer passes by.	Ruth 4:1
Ruth	29	Boaz calls ten elders of the city to sit as witnesses.	Ruth 4:2
Ruth	30	Boaz tells the nearer redeemer about Naomi’s land and the duty to redeem it.	Ruth 4:3–4
Ruth	31	The nearer redeemer agrees to redeem the land until he learns he must also marry Ruth the Moabite.	Ruth 4:5–6
Ruth	32	The nearer redeemer removes his sandal and formally relinquishes his right of redemption to Boaz.	Ruth 4:7–8
Ruth	33	Boaz announces before the elders and people that he is acquiring Ruth as wife to perpetuate name of the dead.	Ruth 4:9–10
Ruth	34	The elders and all at the gate bless Boaz and pray that Ruth may be like Rachel, Leah, and Tamar.	Ruth 4:11–12
Ruth	35	Boaz takes Ruth as his wife, the LORD enables her to conceive, and she bears a son.	Ruth 4:13
Ruth	36	The women of Bethlehem bless Naomi and declare the child a restorer of life and nourisher of her old age.	Ruth 4:14–15
Ruth	37	The women name the child Obed and declare he is son to Naomi.	Ruth 4:16–17
Ruth	38	The book concludes with the genealogy from Perez to David (Perez → Hezron → Ram → Amminadab → Nahshon → Salmon → Boaz → Obed → Jesse → David)	Ruth 4:18–22